{"$id":"https://github.com/afflom/lexlean/schemas/rust-provenance.schema.json","$schema":"https://json-schema.org/draft/2020-12/schema","additionalProperties":false,"properties":{"compiler_semantics":{"pattern":"^[0-9a-f]{64}$","type":"string"},"exports":{"items":{"additionalProperties":false,"properties":{"function":{"minimum":0,"type":"integer"},"name":{"pattern":"^[a-z][a-z0-9_]{0,63}$","type":"string"}},"required":["function","name"],"type":"object"},"minItems":1,"type":"array"},"files":{"additionalProperties":false,"properties":{"Cargo.toml":{"pattern":"^[0-9a-f]{64}$","type":"string"},"src/lib.rs":{"pattern":"^[0-9a-f]{64}$","type":"string"}},"required":["Cargo.toml","src/lib.rs"],"type":"object"},"name":{"pattern":"^[a-z][a-z0-9_]{0,63}$","type":"string"},"profile":{"enum":["rust-core","rust-std"]},"program":{"pattern":"^[0-9a-f]{64}$","type":"string"},"runtime":{"pattern":"^[0-9a-f]{64}$","type":"string"},"sources":{"items":{"pattern":"^[0-9a-f]{64}$","type":"string"},"type":"array"},"spec":{"const":"lexlean/rust-provenance/1"},"version":{"pattern":"^[0-9]+\\.[0-9]+\\.[0-9]+$","type":"string"}},"required":["compiler_semantics","exports","files","name","profile","program","runtime","sources","spec","version"],"title":"LexLean Rust package provenance (SPEC.md §17.16)","type":"object"}
