{"compiler_semantics":"961282f94afc09dbbe84cdae395d5b36b6d57c559e4e5ef73d6a1935cb104e90","exports":[{"function":0,"name":"run"}],"files":{"Cargo.toml":"3af3d260c8a7a536d3b4356bf86216ede694c8c1a9c668e89673e25e9e784112","src/lib.rs":"041e16fb7061b034a9f1bb0493839094c884833b53c6a965bcb5f97eb06dc62d"},"name":"syntax_total","profile":"rust-std","program":"0b283960a85e885aef98cffde5a37a5840fe6905cb960332eb57755a9f588e7b","runtime":"fdc7ed300f2300e6ed6c241a7cb67affb2e94106dd464fd18d53b53ba0427834","sources":["a81caa6bc45b2a427bfc7b86c8e9d840aab6c9902cb9ae24f86b7a76893d844b"],"spec":"lexlean/rust-provenance/1","version":"1.0.0"}
