{"compiler_semantics":"a5d50f19e2842482638a1a0cd3cfc25dff5002e7b181e4848efd1ef41a484bc8","exports":[{"function":0,"name":"run"}],"files":{"Cargo.toml":"4d0cfb5ef3ce72b9fd8cfe426f60ee8c75c7d554746aab9bb334391618f42ce7","src/lib.rs":"0f8790103b62aee5ffc962853dd7a227f9fa4186c501fb49366affbeb2114251"},"name":"bytes_and_text_std","profile":"rust-std","program":"90c512537d4f85ae493b4d8df30d97811078d055c0b69a120949ed63053e089e","runtime":"fdc7ed300f2300e6ed6c241a7cb67affb2e94106dd464fd18d53b53ba0427834","sources":["c5ef7e84718594477b472df24a7c80da7cd07e5141a462563e724e33505e33e7"],"spec":"lexlean/rust-provenance/1","version":"1.0.0"}
