{"compiler_semantics":"961282f94afc09dbbe84cdae395d5b36b6d57c559e4e5ef73d6a1935cb104e90","exports":[{"function":0,"name":"run"}],"files":{"Cargo.toml":"bac87758ae0145c960c00f8badc41eac7c8a85900f4472616b4aa784f4bfebb4","src/lib.rs":"534c18643ecfdfdb6864809e6d39bf903946b2d2a50f8d68028eaa8fb5ec42a0"},"name":"sum_to_exhausted_core","profile":"rust-core","program":"0b5d1623110dd3c47e6d54ff536aea2157c78593eaae53a9752197a171fdc79a","runtime":"7f18f40838cbf5b74494efecbd3553c16cd6b0fb42445bdff4c8036b5f0e2a95","sources":["8ed528528d36d231bdc3017a097b4b0162bb37574f3b84402069c5f8ccc96429"],"spec":"lexlean/rust-provenance/1","version":"1.0.0"}
