{"compiler_semantics":"a5d50f19e2842482638a1a0cd3cfc25dff5002e7b181e4848efd1ef41a484bc8","exports":[{"function":0,"name":"run"}],"files":{"Cargo.toml":"20a5e788febf3f6995f85883485d6e561b1d12dfa390f426c37a4676b4c7e6bd","src/lib.rs":"f1698763cb7a8be07ce074b9da6e70a189538c852fa0cbdcaf3f5e4703eb0573"},"name":"lists_std","profile":"rust-std","program":"6ccce5df53085556ae8de4d7783d2b5f3734fdee0f895ed7c612b695af1b208e","runtime":"fdc7ed300f2300e6ed6c241a7cb67affb2e94106dd464fd18d53b53ba0427834","sources":["c5ef7e84718594477b472df24a7c80da7cd07e5141a462563e724e33505e33e7"],"spec":"lexlean/rust-provenance/1","version":"1.0.0"}
