{"compiler_semantics":"9eecb6fb5f169c7acd40d70993c388a263916c8a7e38de3df7f207b4d7504466","exports":[{"function":0,"name":"run"}],"files":{"Cargo.toml":"7473aca13da8e0e6cf970bffae5f972798f7cbe74fd83f4a572aa2f9e268c43e","src/lib.rs":"7a8ce3bcb63df0174a8a26d5fd41bd12f8841b797894ddd605d55873242225cc"},"name":"set_fold_std","profile":"rust-std","program":"9ec1f516d6a7a34284bd32ea60ad534e79b8a3051e015182f82e02663f083863","runtime":"fdc7ed300f2300e6ed6c241a7cb67affb2e94106dd464fd18d53b53ba0427834","sources":["0b41523010f830db32b70e29e7a8f724a48085949f14f5103cf10028c36fbca6"],"spec":"lexlean/rust-provenance/1","version":"1.0.0"}
