{"compiler_semantics":"961282f94afc09dbbe84cdae395d5b36b6d57c559e4e5ef73d6a1935cb104e90","exports":[{"function":0,"name":"run"}],"files":{"Cargo.toml":"3912b5dd8d90f16cf7f3f96dc90dedbcfe40f29bf8db40b02503eb2cefe1549f","src/lib.rs":"557333a34280ae8dfaa5ba1021b3a887a8b8e487f9fcf3fbd827a399c34fd0ba"},"name":"int_arithmetic_std","profile":"rust-std","program":"74490a35f7912610de983120cac89d47c5a80a56f2d22398ebe0d116219ac822","runtime":"fdc7ed300f2300e6ed6c241a7cb67affb2e94106dd464fd18d53b53ba0427834","sources":["fa02e60c927c5b88c1838bebaeb8dea133769b34d1a212cf57a6603dbdaed8ca"],"spec":"lexlean/rust-provenance/1","version":"1.0.0"}
