{"compiler_semantics":"961282f94afc09dbbe84cdae395d5b36b6d57c559e4e5ef73d6a1935cb104e90","exports":[{"function":0,"name":"run"}],"files":{"Cargo.toml":"52d874842364a98a1ec3af35151dc6553820eb61a73b729963df7c502dc45656","src/lib.rs":"22d132b5c5446dc6d83202e4b4dcc89e82c45e2d2d5051b576198cd1b925745f"},"name":"nat_arithmetic_std","profile":"rust-std","program":"18e386987a44d4e9057579c3775b66c5293ebaa332bb2cba7811f2f828c7df9c","runtime":"fdc7ed300f2300e6ed6c241a7cb67affb2e94106dd464fd18d53b53ba0427834","sources":["8ed528528d36d231bdc3017a097b4b0162bb37574f3b84402069c5f8ccc96429"],"spec":"lexlean/rust-provenance/1","version":"1.0.0"}
