{"compiler_semantics":"961282f94afc09dbbe84cdae395d5b36b6d57c559e4e5ef73d6a1935cb104e90","exports":[{"function":0,"name":"run"}],"files":{"Cargo.toml":"b927ff521f32d7fb2292ab2d020df8a2e1acd30460ac58429f4292741a2f51d3","src/lib.rs":"04ead50359f7ee10e89db48a8c0ad5ca2bb5445d5e7bbb9d54dab7d0e212d17f"},"name":"sum_all","profile":"rust-std","program":"8ff4684c89e1a22e97417561a676319cab5351c711d244d980c53acc6160e821","runtime":"fdc7ed300f2300e6ed6c241a7cb67affb2e94106dd464fd18d53b53ba0427834","sources":["4ca980690bb84cc04fe9ff0bc55e1fbfc2422a1820584705a378d36f203c339a"],"spec":"lexlean/rust-provenance/1","version":"1.0.0"}
