{"compiler_semantics":"961282f94afc09dbbe84cdae395d5b36b6d57c559e4e5ef73d6a1935cb104e90","exports":[{"function":30,"name":"run"}],"files":{"Cargo.toml":"006bdd268983be958dbe85a51c271f1e7315257d78cce3ed57743b23cd195944","src/lib.rs":"ebc97920fbe7bd17c7e9271f775d48e7516e95f0747530c16323119afd93db42"},"name":"graphs","profile":"rust-std","program":"54b3c6a08367cfc9abac0716d282f9bfd50bcfffd1c1c0a5693bf6e6407145e2","runtime":"fdc7ed300f2300e6ed6c241a7cb67affb2e94106dd464fd18d53b53ba0427834","sources":["a81caa6bc45b2a427bfc7b86c8e9d840aab6c9902cb9ae24f86b7a76893d844b"],"spec":"lexlean/rust-provenance/1","version":"1.0.0"}
