{"compiler_semantics":"a5d50f19e2842482638a1a0cd3cfc25dff5002e7b181e4848efd1ef41a484bc8","exports":[{"function":0,"name":"run"}],"files":{"Cargo.toml":"f6bd44702dee9317d3ccfb7cf717124b71b06ad65fbbd675d1efa63547106ec4","src/lib.rs":"b51f3227ad244f0c2abc01f6ed2613919f81b4488f247e489119151d7ae123ac"},"name":"fixed_width_u8_core","profile":"rust-core","program":"10a50859bd6fdf829c844b5c4758a464f5524865ef0b64f63cf0e9bb838c1d8d","runtime":"7f18f40838cbf5b74494efecbd3553c16cd6b0fb42445bdff4c8036b5f0e2a95","sources":["8ff216a3434694e39d84bfeab8b25ad2a611fe6720e8d0e09bdf136b0525adca"],"spec":"lexlean/rust-provenance/1","version":"1.0.0"}
