{"compiler_semantics":"961282f94afc09dbbe84cdae395d5b36b6d57c559e4e5ef73d6a1935cb104e90","exports":[{"function":0,"name":"run"}],"files":{"Cargo.toml":"9baf4aaaf363171f1ee359cc787061e8f3b838a40f496da53d3ef3d2e27afd45","src/lib.rs":"c2dc4825816c504eb18130ab8a0674a79f3f21da2f472053b129f39ad54cb5f1"},"name":"closure_dispatch_std","profile":"rust-std","program":"2c8491e46d4c4170f5f7e314245c304d91dc7cc4401639794e0057c1fbf4ff3e","runtime":"fdc7ed300f2300e6ed6c241a7cb67affb2e94106dd464fd18d53b53ba0427834","sources":["8ed528528d36d231bdc3017a097b4b0162bb37574f3b84402069c5f8ccc96429"],"spec":"lexlean/rust-provenance/1","version":"1.0.0"}
